"Figure 1. Seven-Day Low Streamflows in the United States, 1940-2014",,,
Source: EPA's Climate Change Indicators in the United States: www.epa.gov/climate-indicators,,,
"Data source: USGS, 2016",,,
Web update: August 2016,,,
Units: percent change,,,
,,,
Lat,Long,Station Name,Seven-Day Low Streamflow
47.23739,-68.58264,"Fish River near Fort Kent, Maine",62.27284386
45.50098,-68.30596,"Mattawamkeag River near Mattawamkeag, Maine",2.786612969
45.17501,-69.3147,"Piscataquis River near Dover-Foxcroft, Maine",-7.70242361
44.8692,-69.9551,"Carrabassett River near North Anson, Maine",51.56037231
44.87739,-71.05749,"Diamond River near Wentworth Location, NH",56.81738211
44.64275,-70.58878,"Swift River near Roxbury, Maine",124.226069
44.30399,-70.53968,"Little Androscoggin River near South Paris, Maine",28.83027266
43.1487,-70.96506,"OYSTER RIVER NEAR DURHAM, NH",8.310224591
43.56646,-71.74786,"SMITH RIVER NEAR BRISTOL, NH",52.24313276
41.84371,-72.16897,"MOUNT HOPE RIVER NEAR WARRENVILLE, CT.",17.88491396
44.26867,-71.63036,"AMMONOOSUC RIVER AT BETHLEHEM JUNCTION, NH",47.01005891
44.15034,-72.06509,"WELLS RIVER AT WELLS RIVER, VT",38.86967774
43.93451,-72.65788,"AYERS BROOK AT RANDOLPH, VT",307.1415652
43.71424,-72.41815,"WHITE RIVER AT WEST HARTFORD, VT",90.49113783
42.68259,-72.11508,"PRIEST BROOK NEAR WINCHENDON, MA",41.74404284
42.63842,-72.72509,"NORTH RIVER AT SHATTUCKVILLE, MA",67.99901909
42.23731,-72.89565,"WEST BRANCH WESTFIELD RIVER AT HUNTINGTON, MA",71.15958538
42.03732,-72.93899,"HUBBARD RIVER NR. WEST HARTLAND, CT.",16.26832557
42.31953,-74.43654,SCHOHARIE CREEK AT PRATTSVILLE NY,119.3807924
41.86648,-74.4871,RONDOUT CREEK NEAR LOWES CORNERS NY,45.57986315
42.14481,-74.65349,EAST BR DELAWARE R AT MARGARETVILLE NY,61.52581036
42.1062,-74.73043,MILL BROOK NEAR DUNRAVEN NY,54.88034187
42.12009,-74.81849,TREMPER KILL NEAR ANDES NY,41.74305511
41.89009,-74.58988,NEVERSINK RIVER NEAR CLARYVILLE NY,54.92169547
41.08815,-75.03767,"Bush Kill at Shoemakers, PA",67.61820995
41.10667,-74.95222,FLAT BROOK NEAR FLATBROOKVILLE NJ,17.65673225
41.70702,-76.48467,"Towanda Creek near Monroeton, PA",10.88043093
41.07814,-76.43106,"Fishing Creek near Bloomsburg, PA",24.68860301
41.4134,-78.19695,"Driftwood Br Sinnemahoning Cr at Sterling Run, PA",131.513267
41.4759,-77.82583,"Kettle Creek at Cross Fork, PA",44.53713562
41.52174,-77.44748,"Pine Creek at Cedar Run, PA",61.5878868
41.47368,-77.23081,"Blockhouse Creek near English Center, PA",19.60324992
41.41841,-77.03275,"Lycoming Creek near Trout Run, PA",18.88533631
41.32508,-76.91246,"Loyalsock Creek at Loyalsockville, PA",37.66769294
41.35702,-76.53467,"Muncy Creek near Sonestown, PA",37.4000949
40.21258,-77.92528,"Aughwick Creek near Three Springs, PA",5.206568182
40.32342,-77.16887,"Sherman Creek at Shermans Dale, PA",28.11872118
39.62997,-76.40331,"DEER CREEK AT ROCKS, MD",-5.292826904
38.99122,-79.17587,"SO. BRANCH POTOMAC RIVER NR PETERSBURG, WV",2.034706747
38.63706,-78.8528,"N F SHENANDOAH RIVER AT COOTES STORE, VA",25.7459879
39.08122,-78.32945,"CEDAR CREEK NEAR WINCHESTER, VA",21.18793204
39.01955,-77.57749,"GOOSE CREEK NEAR LEESBURG, VA",-18.43435089
38.35041,-77.975,"RAPIDAN RIVER NEAR CULPEPER, VA",-17.54371519
37.8029,-80.047,"DUNLAP CREEK NEAR COVINGTON, VA",-5.870191891
37.7918,-79.75949,"COWPASTURE RIVER NEAR CLIFTON FORGE, VA",17.81917226
37.66596,-79.91144,"CRAIG CREEK AT PARR, VA",2.252053222
37.71542,-78.98169,"TYE RIVER NEAR LOVINGSTON, VA",-13.90324648
36.71681,-77.83166,"MEHERRIN RIVER NEAR LAWRENCEVILLE, VA",-57.98150157
37.1732,-79.52031,"GOOSE CREEK NEAR HUDDLESTON, VA",-39.36175198
37.12681,-78.95974,"FALLING RIVER NEAR NARUNA, VA",-54.04646679
36.56819,-79.98727,"NORTH MAYO RIVER NEAR SPENCER, VA",-8.262764097
36.61958,-79.50419,"SANDY RIVER NEAR DANVILLE, VA",-19.39685046
36.19417,-78.58306,"TAR RIVER NEAR TAR RIVER, NC",-68.91463766
34.82889,-77.83222,"NORTHEAST CAPE FEAR RIVER NEAR CHINQUAPIN, NC",-26.70826637
36.175,-81.16889,"REDDIES RIVER AT NORTH WILKESBORO, NC",-22.58095955
34.81398,-83.30599,"CHATTOOGA RIVER NEAR CLAYTON, GA",-12.54551285
30.35885,-82.0815,"ST. MARYS RIVER NR MACCLENNY, FLA.",-18.02835827
29.97941,-81.85204,"SOUTH FORK BLACK CREEK NR PENNEY FARMS, FLA.",-52.07845858
30.1133,-81.90649,"NORTH FORK BLACK CREEK NR MIDDLEBURG, FLA.",8.294583404
30.32578,-82.73818,"SUWANNEE RIVER AT WHITE SPRINGS, FLA.",-52.92595822
31.34295,-85.61049,"CHOCTAWHATCHEE RIVER NEAR NEWTON, AL.",-50.33336978
31.57349,-86.25162,CONECUH RIVER AT BRANTLEY AL,-59.86523977
31.4185,-86.98664,MURDER CREEK NEAR EVERGREEN AL,-16.56139981
31.70694,-89.40694,"LEAF RIVER NR COLLINS, MS",3.791782234
31.42583,-89.41472,"BOUIE CREEK NR HATTIESBURG, MS",-13.60690452
41.85256,-79.31727,"Brokenstraw Creek at Youngsville, PA",43.07599576
40.7159,-79.69949,"Buffalo Creek near Freeport, PA",252.7233963
39.12705,-79.46839,"BLACKWATER R AT DAVIS, WV",67.01250461
39.12288,-79.68117,"CHEAT RIVER NEAR PARSONS, WV",63.73014096
39.61564,-79.70477,"BIG SANDY CREEK AT ROCKVILLE, WV",127.3774374
40.36285,-81.86236,Mill Creek near Coshocton OH,198.4438942
40.13257,-82.14792,Wakatomika Creek near Frazeysburg OH,23.71815464
36.39333,-81.40694,"SOUTH FORK NEW RIVER NEAR JEFFERSON, NC",-1.4573038
36.64735,-80.97897,"NEW RIVER NEAR GALAX, VA",-7.150176294
37.03763,-80.55672,"LITTLE RIVER AT GRAYSONTOWN, VA",-6.848217773
37.26818,-80.70951,"WALKER CREEK AT BANE, VA",-5.016972667
38.18595,-80.13062,"GREENBRIER RIVER AT BUCKEYE, WV",14.28278153
38.379,-80.48397,"WILLIAMS RIVER AT DYER, WV",41.98434671
38.80368,-83.42102,Ohio Brush Creek near West Union OH,29.26693154
38.85812,-83.92854,White Oak Creek near Georgetown OH,0
37.47981,-83.67519,"SOUTH FORK KENTUCKY RIVER AT BOONEVILLE, KY",230.1571321
39.01004,-87.94559,"NORTH FORK EMBARRAS RIVER NEAR OBLONG, IL",-50.66838882
35.14333,-82.82472,"FRENCH BROAD RIVER AT ROSMAN, NC",-7.025066427
36.65178,-81.84401,"S F HOLSTON RIVER NEAR DAMASCUS, VA",-1.634190248
36.23917,-81.82222,"WATAUGA RIVER NEAR SUGAR GROVE, NC",3.681995899
36.89678,-81.74623,"N F HOLSTON RIVER NEAR SALTVILLE, VA",8.033771948
35.1275,-83.61861,"NANTAHALA RIVER NEAR RAINBOW SPRINGS, NC",-18.47282218
34.62425,-86.30637,PAINT ROCK RIVER NEAR WOODVILLE AL,27.92863135
35.49591,-87.8328,"BUFFALO RIVER NEAR FLAT WOODS, TN",48.52785228
46.03053,-86.16125,"MANISTIQUE RIVER NEAR MANISTIQUE, MI",-1.448317939
43.94501,-86.27869,"PERE MARQUETTE RIVER AT SCOTTVILLE, MI",19.59431386
44.43639,-85.69868,"MANISTEE RIVER NEAR SHERMAN, MI",-5.109189708
41.5045,-84.42967,Tiffin River at Stryker OH,13.60995076
42.39313,-76.54494,CAYUGA INLET NEAR ITHACA NY,14.56404672
48.13834,-100.53986,"WINTERING RIVER NR KARLSRUHE, ND",112.2106453
48.39578,-93.54933,"LITTLE FORK RIVER AT LITTLEFORK, MN",15.61004639
45.29163,-96.48756,"WHETSTONE RIVER NEAR BIG STONE CITY, SD",1642.627751
45.30803,-90.95653,"JUMP RIVER AT SHELDON, WI",28.99854557
44.82191,-90.07958,"BIG EAU PLEINE RIVER AT STRATFORD, WI",323.8633682
43.57414,-90.64319,"KICKAPOO RIVER AT LA FARGE, WI",80.77481468
42.73999,-91.2618,"Turkey River at Garber, IA",135.7289697
42.72027,-90.81929,"GRANT RIVER AT BURTON, WI",101.8310756
42.7311,-90.64041,"PLATTE RIVER NEAR ROCKVILLE, WI",59.30845315
41.90281,-89.69622,"ELKHORN CREEK NEAR PENROSE, IL",140.4874375
41.70002,-91.48767,"Rapid Creek near Iowa City, IA",179.6096599
41.18698,-90.96737,"EDWARDS RIVER NEAR NEW BOSTON, IL",73.35093077
40.39241,-91.59788,"Fox River at Wayland, MO",194.0773916
39.81799,-91.5177,"North River at Palmyra, MO",42.66098602
41.36587,-89.49843,"BIG BUREAU CREEK AT PRINCETON, IL",632.8761299
40.02477,-90.63179,"LA MOINE RIVER AT RIPLEY, IL",39.91823515
45.11188,-110.79438,Yellowstone River at Corwin Springs MT,5.808375823
45.00691,-107.6151,Little Bighorn River at State Line nr Wyola MT,-1.583885257
46.37611,-100.93444,"CANNONBALL RIVER AT BREIEN, ND",123.6373313
44.32665,-100.3843,BAD R NEAR FORT PIERRE SD,NA
43.74833,-99.55649,WHITE R NEAR OACOMA SD,159.3114493
39.09938,-95.72495,"SOLDIER C NR TOPEKA, KS",122.4163127
39.11633,-95.01088,"STRANGER C NR TONGANOXIE, KS",26.11204688
35.98318,-92.74755,"Buffalo River near St. Joe, AR",-11.41902258
37.15408,-91.35816,"Jacks Fork at Eminence, MO",27.36575211
36.622,-90.84762,"Current River at Doniphan, MO",15.0080625
36.64868,-91.20082,"Eleven Point River near Bardley, MO",20.20694254
38.19645,-96.82458,"CEDAR C NR CEDAR POINT, KS",3.215638078
36.37226,-104.97,"RAYADO CREEK NEAR CIMARRON, NM",14.10341692
31.50306,-90.7775,"HOMOCHITTO RIVER AT EDDICETON, MS",10.12095568
30.5038,-90.67732,"Tickfaw River at Holden, LA",-12.2494718
30.69875,-92.89319,"Whiskey Chitto Creek Near Oberlin, LA",-14.4062108
30.3366,-95.1041,"E Fk San Jacinto Rv nr Cleveland, TX",20.10305438
28.95998,-96.68637,"Lavaca Rv nr Edna, TX",-38.17190833
28.29195,-97.27916,"Mission Rv at Refugio, TX",15.8216084
29.42857,-99.99729,"Nueces Rv at Laguna, TX",22.18141763
29.48856,-99.70478,"Frio Rv at Concan, TX",44.59866308
36.54169,-105.5564,"RIO HONDO NEAR VALDEZ, NM",-5.492414824
35.70837,-105.68252,"PECOS RIVER NEAR PECOS, NM",22.33193482
35.65199,-105.3189,"GALLINAS CREEK NEAR MONTEZUMA, NM",72.32668986
33.06118,-108.53728,"GILA RIVER NEAR GILA, NM",-9.782854247
41.74438,-111.78439,COM F LOGAN R AB ST D AND LO HP AND SM C N LO UT,-4.570231566
38.28053,-112.56827,"BEAVER RIVER NEAR BEAVER, UT",-2.022689674
37.6722,-113.03467,"COAL CREEK NEAR CEDAR CITY, UT",16.7999592
34.42083,-117.83951,BIG ROCK C NR VALYERMO CA,-47.25149768
41.53462,-117.4179,"MARTIN C NR PARADISE VALLEY, NV",1.93999089
42.79083,-118.8675,DONNER UND BLITZEN RIVER NR FRENCHGLEN OR,0.794008948
34.22223,-118.17757,ARROYO SECO NR PASADENA CA,-31.44781014
34.59666,-119.90875,SANTA CRUZ C NR SANTA YNEZ CA,NA
37.33939,-118.97345,BEAR C NR LAKE THOMAS A EDISON CA,21.56521149
37.19856,-119.21373,PITMAN C BL TAMARACK C CA,5.172166176
37.73159,-119.55877,MERCED R A HAPPY ISLES BRIDGE NR YOSEMITE CA,29.95470595
37.31549,-121.12521,ORESTIMBA C NR NEWMAN CA,NA
38.51908,-120.21269,COLE C NR SALT SPRINGS DAM CA,-4.024350724
40.0546,-122.02415,MILL C NR LOS MOLINOS CA,-6.097409255
40.01405,-121.94832,DEER C NR VINA CA,-10.42941165
41.37763,-123.47756,SALMON R A SOMES BAR CA,-9.697578268
41.7915,-124.07619,SMITH R NR CRESCENT CITY CA,-4.636891715
46.37399,-123.74348,"NASELLE RIVER NEAR NASELLE, WA",-26.92445789
46.61732,-123.27764,"CHEHALIS RIVER NEAR DOTY, WA",-20.51495924
47.00065,-123.49488,"SATSOP RIVER NEAR SATSOP, WA",-7.563012538
48.01426,-123.13268,"DUNGENESS RIVER NEAR SEQUIM, WA",-17.99833386
47.68398,-123.01155,"DUCKABUSH RIVER NEAR BRINNON, WA",-16.7410418
47.51426,-123.32989,"NF SKOKOMISH R BL STAIRCASE RPDS NR HOODSPORT, WA",-21.60079094
48.26149,-122.04764,"NF STILLAGUAMISH RIVER NEAR ARLINGTON, WA",-27.78341658
48.67263,-121.0729,"THUNDER CREEK NEAR NEWHALEM, WA",20.51364031
48.16872,-121.47067,"SAUK RIVER AB WHITECHUCK RIVER NEAR DARRINGTON, WA",-21.99500457
48.42456,-121.56846,"SAUK RIVER NEAR SAUK, WA",-24.23328865
48.49524,-114.01012,Middle Fork Flathead River nr West Glacier MT,6.693549952
47.56889,-116.25333,NF COEUR D ALENE RIVER AT ENAVILLE ID,-4.549831729
47.27464,-116.18905,ST JOE RIVER AT CALDER ID,-8.494758975
48.32958,-120.69177,"STEHEKIN RIVER AT STEHEKIN, WA",-0.719580152
46.97762,-121.1687,"AMERICAN RIVER NEAR NILE, WA",-5.472392401
42.16583,-113.98361,TRAPPER CREEK NR OAKLEY ID,-15.27777633
43.65944,-115.72722,BOISE RIVER NR TWIN SPRINGS ID,-6.853038968
44.08528,-115.62222,SF PAYETTE RIVER AT LOWMAN ID,-16.90340806
44.96167,-115.5,JOHNSON CREEK AT YELLOW PINE ID,-10.27954026
46.15083,-115.58722,LOCHSA RIVER NR LOWELL ID,-16.86221608
45.71958,-118.32329,"UMATILLA RIVER ABOVE MEACHAM CREEK, NR GIBBON, OR",-8.454770325
45.39956,-122.13731,"SANDY RIVER NEAR MARMOT, OR",-12.11913076
45.4154,-122.17147,"LITTLE SANDY RIVER NEAR BULL RUN, OREG.",-20.71127664
43.73596,-122.8734,"ROW RIVER ABOVE PITCHER CREEK NEAR, DORENA, OREG",-7.741908696
44.04984,-123.42621,"LONG TOM RIVER NEAR NOTI, OREG.",-29.37468149
44.79151,-122.57897,"LITTLE NORTH SANTIAM RIVER NEAR MEHAMA, OR",-7.603216399
44.39179,-122.49758,"SOUTH SANTIAM RIVER BELOW CASCADIA, OR",-24.06588257
45.83678,-122.46621,"EAST FORK LEWIS RIVER NEAR HEISSON, WA",-15.55708514
45.704,-123.75541,"NEHALEM RIVER NEAR FOSS, OR",-12.55016618
44.71512,-123.88733,"SILETZ RIVER AT SILETZ, OR",-28.82670306
44.38595,-123.83178,"ALSEA RIVER NEAR TIDEWATER, OR",-11.55550657
42.8915,-124.07065,"SOUTH FORK COQUILLE RIVER AT POWERS, OR",-21.91135079
55.3916,-131.19558,FISH C NR KETCHIKAN AK,60.18687094
22.13267,-159.61998,"Kawaikoi Stream nr Waimea, Kauai, HI",-7.779949276
22.06877,-159.41526,"EB of NF Wailua River nr Lihue, Kauai, HI",-10.79672444
21.3635,-157.8442,"Kalihi Str nr Honolulu, Oahu, HI",-4.516076715
21.1555,-156.76197,"Halawa Stream near Halawa, Molokai, HI",-16.36412316
20.80686,-156.11422,"Hanawi Stream near Nahiku, Maui, HI",-21.96797431
20.81769,-156.14103,"West Wailuaiki Stream near Keanae, Maui, HI",-34.34360234
20.88568,-156.25274,"Honopou Stream near Huelo, Maui, HI",-29.55914972
